{
    "active": false,
    "conditions": [
        1,
        2,
        3
    ],
    "counter": 1,
    "description": "Example description",
    "expression": "{1} AND ({2} OR {3})",
    "gameType": "ONE_TIME",
    "name": "Example",
    "notifications": [
        2,
        4
    ],
    "priority": 1,
    "transactionSource": 1
}